[
  {
    "slug": "geosight",
    "name": "GeoSight",
    "description": "UNICEF's open source geospatial data platform, enhanced during the \"Ahead of the Storm\" hackathon to support disaster preparedness and child-centric climate risk analysis.",
    "organizations": ["unicef"],
    "provenance": {
      "source_url": "https://www.un.org/digital-emerging-technologies/sites/www.un.org.techenvoy/files/UN_Open_Source_Week_Conference_Report_2025.pdf",
      "source_title": "UN Open Source Week 2025 Conference Report (RISE 2026:04)",
      "license": "CC-BY-4.0",
      "attribution": "Sachiko Muto, RISE / OpenForum Europe",
      "retrieved": "2026-06-29",
      "method": "manual-extraction",
      "locator": "Day 1 and 2; Hackathon – Building for UNICEF"
    }
  },
  {
    "slug": "wikipedia",
    "name": "Wikipedia",
    "description": "The free, collaboratively edited encyclopedia. The Edit-A-Thon expanded Wikipedia's coverage of global digital policy, adding more than 1,000 edits and 16,500 words across key articles.",
    "website": "https://www.wikipedia.org/",
    "organizations": ["wikimedia-foundation"],
    "provenance": {
      "source_url": "https://www.un.org/digital-emerging-technologies/sites/www.un.org.techenvoy/files/UN_Open_Source_Week_Conference_Report_2025.pdf",
      "source_title": "UN Open Source Week 2025 Conference Report (RISE 2026:04)",
      "license": "CC-BY-4.0",
      "attribution": "Sachiko Muto, RISE / OpenForum Europe",
      "retrieved": "2026-06-29",
      "method": "manual-extraction",
      "locator": "Day 1 and 2; Edit-A-Thon – Knowledge as a Commons"
    }
  },
  {
    "slug": "matrix",
    "name": "Matrix",
    "description": "An open standard and open source project for secure, decentralised real-time communication, stewarded by the Matrix.org Foundation and commercially supported by Element.",
    "website": "https://matrix.org/",
    "organizations": ["matrix-foundation"],
    "provenance": {
      "source_url": "https://www.un.org/digital-emerging-technologies/sites/www.un.org.techenvoy/files/UN_Open_Source_Week_Conference_Report_2025.pdf",
      "source_title": "UN Open Source Week 2025 Conference Report (RISE 2026:04)",
      "license": "CC-BY-4.0",
      "attribution": "Sachiko Muto, RISE / OpenForum Europe",
      "retrieved": "2026-06-29",
      "method": "manual-extraction",
      "locator": "Day 2 Breakout 1 (Amandine Le Pape, Element / Matrix.org Foundation)"
    }
  },
  {
    "slug": "arduino",
    "name": "Arduino",
    "description": "Open source electronics platform combining open hardware and software, referenced in the context of open source skills and education.",
    "website": "https://www.arduino.cc/",
    "provenance": {
      "source_url": "https://www.un.org/digital-emerging-technologies/sites/www.un.org.techenvoy/files/UN_Open_Source_Week_Conference_Report_2025.pdf",
      "source_title": "UN Open Source Week 2025 Conference Report (RISE 2026:04)",
      "license": "CC-BY-4.0",
      "attribution": "Sachiko Muto, RISE / OpenForum Europe",
      "retrieved": "2026-06-29",
      "method": "manual-extraction",
      "locator": "Day 2 Breakout 1 (David Cuartielles, Co-founder, Arduino)"
    }
  },
  {
    "slug": "drupal",
    "name": "Drupal",
    "description": "Open source content management framework, referenced through Drupal/Palantir.Net and the Drupal Association across the DPI cross-border panel and Community Day.",
    "website": "https://www.drupal.org/",
    "organizations": ["palantir-net"],
    "provenance": {
      "source_url": "https://www.un.org/digital-emerging-technologies/sites/www.un.org.techenvoy/files/UN_Open_Source_Week_Conference_Report_2025.pdf",
      "source_title": "UN Open Source Week 2025 Conference Report (RISE 2026:04)",
      "license": "CC-BY-4.0",
      "attribution": "Sachiko Muto, RISE / OpenForum Europe",
      "retrieved": "2026-06-29",
      "method": "manual-extraction",
      "locator": "DPI Day; Global Cooperation for DPI panel (Tiffany Farriss)"
    }
  },
  {
    "slug": "software-heritage-archive",
    "name": "Software Heritage Archive",
    "description": "An archive preserving the source code of more than 180 million open source projects, cited as essential shared infrastructure for digital cooperation.",
    "website": "https://www.softwareheritage.org/",
    "organizations": ["software-heritage"],
    "provenance": {
      "source_url": "https://www.un.org/digital-emerging-technologies/sites/www.un.org.techenvoy/files/UN_Open_Source_Week_Conference_Report_2025.pdf",
      "source_title": "UN Open Source Week 2025 Conference Report (RISE 2026:04)",
      "license": "CC-BY-4.0",
      "attribution": "Sachiko Muto, RISE / OpenForum Europe",
      "retrieved": "2026-06-29",
      "method": "manual-extraction",
      "locator": "Day 3; Navigating Digital Cooperation panel (Roberto Di Cosmo)"
    }
  },
  {
    "slug": "decidim",
    "name": "Decidim",
    "description": "Open source participatory democracy platform, presented in the context of digital public goods as infrastructure.",
    "website": "https://decidim.org/",
    "provenance": {
      "source_url": "https://www.un.org/digital-emerging-technologies/sites/www.un.org.techenvoy/files/UN_Open_Source_Week_Conference_Report_2025.pdf",
      "source_title": "UN Open Source Week 2025 Conference Report (RISE 2026:04)",
      "license": "CC-BY-4.0",
      "attribution": "Sachiko Muto, RISE / OpenForum Europe",
      "retrieved": "2026-06-29",
      "method": "manual-extraction",
      "locator": "Community Day; Digital Public Goods as Infrastructure session"
    }
  },
  {
    "slug": "fiware",
    "name": "FIWARE",
    "description": "Open source platform and curated framework of components for building smart digital solutions, presented as a lesson source for open source DPI.",
    "website": "https://www.fiware.org/",
    "provenance": {
      "source_url": "https://www.un.org/digital-emerging-technologies/sites/www.un.org.techenvoy/files/UN_Open_Source_Week_Conference_Report_2025.pdf",
      "source_title": "UN Open Source Week 2025 Conference Report (RISE 2026:04)",
      "license": "CC-BY-4.0",
      "attribution": "Sachiko Muto, RISE / OpenForum Europe",
      "retrieved": "2026-06-29",
      "method": "manual-extraction",
      "locator": "Community Day; Open Standards, Open Source, Futures (FIWARE) session"
    }
  },
  {
    "slug": "mojaloop",
    "name": "Mojaloop",
    "description": "Open source software for interoperable digital payments and financial inclusion, stewarded by the Mojaloop Foundation.",
    "website": "https://mojaloop.io/",
    "provenance": {
      "source_url": "https://www.un.org/digital-emerging-technologies/sites/www.un.org.techenvoy/files/UN_Open_Source_Week_Conference_Report_2025.pdf",
      "source_title": "UN Open Source Week 2025 Conference Report (RISE 2026:04)",
      "license": "CC-BY-4.0",
      "attribution": "Sachiko Muto, RISE / OpenForum Europe",
      "retrieved": "2026-06-29",
      "method": "manual-extraction",
      "locator": "Community Day; Digital Public Goods as Infrastructure session (Paula Hunter, Mojaloop Foundation)"
    }
  }
]
